{
  "schema_version": 1,
  "proposal_id": "11111111-1111-4111-8111-111111111111",
  "revision": 1,
  "kind": "calendar_event",
  "payload": {
    "kind": "calendar_event",
    "title": "Design review",
    "start_at": "2026-08-27T01:00:00.000Z",
    "end_at": "2026-08-27T01:30:00.000Z",
    "all_day": false,
    "time_zone": "Asia/Shanghai",
    "location_label": "Studio",
    "notes": null
  },
  "payload_hash": "025b6f8ab0826324bbcbc4d2d3d7e92a492735931c4543639bb96e043726475c",
  "title": "Add Design review to Calendar",
  "rationale": "The memo includes a concrete time.",
  "source_refs": [{ "kind": "memo", "id": "22222222-2222-4222-8222-222222222222" }],
  "creator_source": "mcp",
  "creator_device_id_hash": null,
  "redaction_level": "private",
  "target_device_preference": "any",
  "target_device_id_hash": null,
  "state": "pending",
  "created_at": "2026-08-26T10:00:00.000Z",
  "expires_at": "2026-09-02T10:00:00.000Z",
  "deleted_at": null
}
