{
  "schema_version": 1,
  "proposal_id": "71111111-1111-4111-8111-111111111111",
  "revision": 1,
  "kind": "route",
  "payload": {
    "kind": "route",
    "destination_label": "Design studio",
    "destination_address": "100 Design Road, Shanghai",
    "transport": "transit"
  },
  "payload_hash": "410be5ef81f052e92f476dc346688684d3e4df0241dd580c0bc25fa867db00f9",
  "title": "Open route to Design studio",
  "rationale": "The destination has an address but no resolved coordinates.",
  "source_refs": [],
  "creator_source": "mcp",
  "creator_device_id_hash": null,
  "redaction_level": "private",
  "target_device_preference": "any",
  "target_device_id_hash": null,
  "state": "pending",
  "created_at": "2026-08-27T10:00:00.000Z",
  "expires_at": null,
  "deleted_at": null
}
